{
  "templateName": "PatientReportTemplate",
  "patient": {
    "firstName": "Heinz",
    "lastName": "Huber",
    "decimalField": 25.5,
    "integerField": 10,
    "age": 76,
    "comments": [
      {
        "comment": "Butchered the left eye.",
        "doctorEmail": "dr.mabuse@gmail.com"
      },
      {
        "comment": "Patient can see now for miles with right eye.",
        "doctorEmail": "dr.house@gmail.com"
      }
    ]
  },
  "od": {
    "laterality": "OD",
    "surgeon": "Dr. House"
  },
  "os": {
    "laterality": "OS",
    "surgeon": "Dr. Mabuse"
  }
}